{
  "$schema": "https://anthropic.com/claude-code/plugin.schema.json",
  "name": "merge-dependabot-bump-pr",
  "description": "Review and merge Dependabot version bump PRs with 4-point safety checks (release age, critical bugs, breaking changes, source diff).",
  "version": "0.1.0",
  "author": {
    "name": "mizunashi-mana",
    "url": "https://github.com/mizunashi-mana"
  },
  "homepage": "https://github.com/mizunashi-mana/agent-skills",
  "repository": "https://github.com/mizunashi-mana/agent-skills",
  "license": "Apache-2.0 OR MPL-2.0"
}
