{
  "$schema": "https://anthropic.com/claude-code/plugin.schema.json",
  "name": "agent-coach",
  "description": "Analyze recent Claude Code transcripts and suggest improvements to user prompts, skill definitions, memory, and context management.",
  "version": "0.1.0",
  "author": {
    "name": "mizunashi-mana",
    "url": "https://github.com/mizunashi-mana"
  },
  "homepage": "https://github.com/mizunashi-mana/agent-skills",
  "repository": "https://github.com/mizunashi-mana/agent-skills",
  "license": "Apache-2.0 OR MPL-2.0"
}
